<login xmlns:xsi="http://www.w3.org/2001/XMLSchema-instance" xsi:noNamespaceSchemaLocation="Usuarios_esquema.xsd">
	<usuario>
		<nombre>admin</nombre>
		<pass>admin</pass>
		<tipo>Administrador</tipo>
	</usuario>
<<<<<<< HEAD
        <usuario>
		<nombre>p</nombre>
		<pass>p</pass>
		<tipo>Profesor</tipo>
	</usuario>
=======
>>>>>>> 9ebbf4962abab179cb3f57bdbafeb8910e11f68a
</login>

